{
  "access": {
    "classification": "internal"
  },
  "description": "The level each public market index closed at on each delivered date.",
  "freshness": "daily by 06:00 UTC",
  "identity": {
    "domain": "reference",
    "major": 1,
    "name": "benchmark_index",
    "namespace": "io.antikas.ergasterion"
  },
  "lineage": [
    "reference.benchmark_index_returns@1"
  ],
  "quality": [
    {
      "description": "benchmark_id must not be null",
      "dimension": "completeness"
    },
    {
      "description": "index_date must not be null",
      "dimension": "completeness"
    }
  ],
  "relations": [
    {
      "fields": [
        {
          "name": "benchmark_id",
          "required": true,
          "type": "string"
        },
        {
          "name": "benchmark_name",
          "required": false,
          "type": "string"
        },
        {
          "name": "benchmark_on",
          "required": false,
          "type": "date"
        },
        {
          "name": "benchmark_index_value",
          "required": false,
          "type": {
            "name": "decimal",
            "precision": 18,
            "scale": 4
          }
        },
        {
          "name": "benchmark_currency",
          "required": false,
          "type": "string"
        },
        {
          "name": "benchmark_label",
          "required": false,
          "type": "string"
        }
      ],
      "name": "reference.benchmark_index"
    }
  ],
  "schema": "ergasterion.product-contract/v1",
  "support": "platform-support",
  "team": "data-product-factory",
  "versioningPolicy": "additive nullable fields are minor and non-breaking; removals, renames, type changes and new required fields are major and breaking"
}
