{
  "access": {
    "classification": "internal"
  },
  "description": "The segment each customer sat in, one row per version, effective from a date.",
  "freshness": "daily by 06:00 UTC",
  "identity": {
    "domain": "reference",
    "major": 1,
    "name": "customer_segment",
    "namespace": "io.antikas.ergasterion"
  },
  "lineage": [
    "reference.customer_segment_history@1"
  ],
  "quality": [
    {
      "description": "customer_external_id must not be null",
      "dimension": "completeness"
    },
    {
      "description": "segment must not be null",
      "dimension": "completeness"
    }
  ],
  "relations": [
    {
      "fields": [
        {
          "name": "customer_external_id",
          "required": true,
          "type": "string"
        },
        {
          "name": "segment_name",
          "required": false,
          "type": "string"
        },
        {
          "name": "segment_effective_from",
          "required": false,
          "type": "date"
        },
        {
          "name": "segment_record_source",
          "required": false,
          "type": "string"
        },
        {
          "name": "segment_load_datetime",
          "required": false,
          "type": "timestamp"
        },
        {
          "name": "segment_label",
          "required": false,
          "type": "string"
        }
      ],
      "name": "reference.customer_segment"
    }
  ],
  "schema": "ergasterion.product-contract/v1",
  "support": "platform-support",
  "team": "data-product-factory",
  "versioningPolicy": "additive nullable fields are minor and non-breaking; removals, renames, type changes and new required fields are major and breaking"
}
