{
  "access": {
    "classification": "internal"
  },
  "description": "The canonical article interface: the agreed form of every article the estate recognises.",
  "freshness": "daily by 09:00 UTC",
  "identity": {
    "domain": "ecommerce",
    "major": 1,
    "name": "product_interface",
    "namespace": "io.antikas.ergasterion"
  },
  "lineage": [
    "ecommerce.product@1"
  ],
  "quality": [
    {
      "description": "product_code must not be null",
      "dimension": "completeness"
    }
  ],
  "relations": [
    {
      "fields": [
        {
          "name": "product_code",
          "required": true,
          "type": "string"
        },
        {
          "name": "product_name",
          "required": false,
          "type": "string"
        },
        {
          "name": "product_brand",
          "required": false,
          "type": "string"
        },
        {
          "name": "product_category",
          "required": false,
          "type": "string"
        },
        {
          "name": "product_list_price",
          "required": false,
          "type": {
            "name": "decimal",
            "precision": 12,
            "scale": 2
          }
        },
        {
          "name": "product_currency",
          "required": false,
          "type": "string"
        },
        {
          "name": "product_status",
          "required": false,
          "type": "string"
        }
      ],
      "name": "ecommerce.product_interface__product"
    }
  ],
  "schema": "ergasterion.product-contract/v1",
  "support": "platform-support",
  "team": "data-product-factory",
  "versioningPolicy": "additive nullable fields are minor and non-breaking; removals, renames, type changes and new required fields are major and breaking"
}
