{
  "access": {
    "classification": "confidential"
  },
  "description": "The order star: one fact at order line grain, analysed by the customer, the segment in force and the article.",
  "freshness": "daily by 09:00 UTC",
  "identity": {
    "domain": "ecommerce",
    "major": 1,
    "name": "order_star",
    "namespace": "io.antikas.ergasterion"
  },
  "lineage": [
    "ecommerce.order_line_detail@1"
  ],
  "quality": [
    {
      "description": "customer_business_key must not be null",
      "dimension": "completeness"
    }
  ],
  "relations": [
    {
      "fields": [
        {
          "name": "customer_business_key",
          "required": true,
          "type": "string"
        },
        {
          "name": "customer_external_id",
          "required": false,
          "type": "string"
        },
        {
          "name": "customer_name",
          "required": false,
          "type": "string"
        },
        {
          "name": "customer_email_domain",
          "required": false,
          "type": "string"
        },
        {
          "name": "customer_city",
          "required": false,
          "type": "string"
        },
        {
          "name": "customer_country",
          "required": false,
          "type": "string"
        }
      ],
      "name": "ecommerce.order_star__dim_customer"
    },
    {
      "fields": [
        {
          "name": "customer_business_key",
          "required": true,
          "type": "string"
        },
        {
          "name": "segment_name",
          "required": false,
          "type": "string"
        },
        {
          "name": "effective_from",
          "required": true,
          "type": "date"
        },
        {
          "name": "effective_to",
          "required": false,
          "type": "date"
        }
      ],
      "name": "ecommerce.order_star__dim_customer_segment"
    },
    {
      "fields": [
        {
          "name": "product_code",
          "required": true,
          "type": "string"
        },
        {
          "name": "product_name",
          "required": false,
          "type": "string"
        },
        {
          "name": "product_brand",
          "required": false,
          "type": "string"
        },
        {
          "name": "product_category",
          "required": false,
          "type": "string"
        },
        {
          "name": "product_list_price",
          "required": false,
          "type": {
            "name": "decimal",
            "precision": 12,
            "scale": 2
          }
        }
      ],
      "name": "ecommerce.order_star__dim_product"
    },
    {
      "fields": [
        {
          "name": "order_id",
          "required": true,
          "type": "string"
        },
        {
          "name": "line_number",
          "required": true,
          "type": "integer"
        },
        {
          "name": "customer_business_key",
          "required": true,
          "type": "string"
        },
        {
          "name": "product_code",
          "required": false,
          "type": "string"
        },
        {
          "name": "line_order_date",
          "required": false,
          "type": "date"
        },
        {
          "name": "line_quantity",
          "required": false,
          "type": "integer"
        },
        {
          "name": "line_revenue",
          "required": false,
          "type": {
            "name": "decimal",
            "precision": 12,
            "scale": 2
          }
        },
        {
          "name": "line_list_value",
          "required": false,
          "type": {
            "name": "decimal",
            "precision": 12,
            "scale": 2
          }
        }
      ],
      "name": "ecommerce.order_star__fact_order_line"
    }
  ],
  "schema": "ergasterion.product-contract/v1",
  "support": "platform-support",
  "team": "data-product-factory",
  "versioningPolicy": "additive nullable fields are minor and non-breaking; removals, renames, type changes and new required fields are major and breaking"
}
