{
  "access": {
    "classification": "internal"
  },
  "description": "The delivered history of how each investment was classified, one row per version, effective from a date.",
  "freshness": "daily by 05:00 UTC",
  "identity": {
    "domain": "reference",
    "major": 1,
    "name": "investment_classification_history",
    "namespace": "io.antikas.ergasterion"
  },
  "lineage": [
    "reference.investment_classification_history_delivery@1"
  ],
  "quality": [
    {
      "description": "entity_external_id must not be null",
      "dimension": "completeness"
    },
    {
      "description": "classification_type_code must not be null",
      "dimension": "completeness"
    },
    {
      "description": "effective_from must not be null",
      "dimension": "completeness"
    }
  ],
  "relations": [
    {
      "fields": [
        {
          "name": "entity_type",
          "required": false,
          "type": "string"
        },
        {
          "name": "entity_external_id",
          "required": false,
          "type": "string"
        },
        {
          "name": "classification_type_code",
          "required": false,
          "type": "string"
        },
        {
          "name": "classification_value_code",
          "required": false,
          "type": "string"
        },
        {
          "name": "effective_from",
          "required": false,
          "type": "string"
        },
        {
          "name": "record_source",
          "required": false,
          "type": "string"
        },
        {
          "name": "load_datetime",
          "required": false,
          "type": "string"
        }
      ],
      "name": "reference.investment_classification_history"
    }
  ],
  "schema": "ergasterion.product-contract/v1",
  "support": "platform-support",
  "team": "data-product-factory",
  "versioningPolicy": "additive nullable fields are minor and non-breaking; removals, renames, type changes and new required fields are major and breaking"
}
