{
  "access": {
    "classification": "confidential"
  },
  "description": "The CHRONO provider fund cash flow feed as it was delivered, one row per delivered cash flow event.",
  "freshness": "daily by 05:00 UTC",
  "identity": {
    "domain": "investment",
    "major": 1,
    "name": "chrono_cash_flow_extract",
    "namespace": "io.antikas.ergasterion"
  },
  "lineage": [
    "investment.chrono_cash_flow_extract_delivery@1"
  ],
  "quality": [
    {
      "description": "event_uid must not be null",
      "dimension": "completeness"
    },
    {
      "description": "event_uid must be unique",
      "dimension": "uniqueness"
    },
    {
      "description": "vehicle_code must not be null",
      "dimension": "completeness"
    },
    {
      "description": "event_date must not be null",
      "dimension": "completeness"
    }
  ],
  "relations": [
    {
      "fields": [
        {
          "name": "event_uid",
          "required": false,
          "type": "string"
        },
        {
          "name": "vehicle_code",
          "required": false,
          "type": "string"
        },
        {
          "name": "event_date",
          "required": false,
          "type": "string"
        },
        {
          "name": "event_kind",
          "required": false,
          "type": "string"
        },
        {
          "name": "investor_direction",
          "required": false,
          "type": "string"
        },
        {
          "name": "usd_amount",
          "required": false,
          "type": "string"
        },
        {
          "name": "currency_code",
          "required": false,
          "type": "string"
        }
      ],
      "name": "investment.chrono_cash_flow_extract"
    }
  ],
  "schema": "ergasterion.product-contract/v1",
  "support": "platform-support",
  "team": "data-product-factory",
  "versioningPolicy": "additive nullable fields are minor and non-breaking; removals, renames, type changes and new required fields are major and breaking"
}
