{
  "access": {
    "classification": "confidential"
  },
  "description": "The ORIGO pipeline system deal feed as it was delivered, one row per delivered deal record.",
  "freshness": "daily by 05:00 UTC",
  "identity": {
    "domain": "investment",
    "major": 1,
    "name": "origo_deal_extract",
    "namespace": "io.antikas.ergasterion"
  },
  "lineage": [
    "investment.origo_deal_extract_delivery@1"
  ],
  "quality": [
    {
      "description": "deal_id must not be null",
      "dimension": "completeness"
    },
    {
      "description": "deal_id must be unique",
      "dimension": "uniqueness"
    },
    {
      "description": "deal_name must not be null",
      "dimension": "completeness"
    },
    {
      "description": "sourced_date must not be null",
      "dimension": "completeness"
    }
  ],
  "relations": [
    {
      "fields": [
        {
          "name": "deal_id",
          "required": false,
          "type": "string"
        },
        {
          "name": "external_deal_id",
          "required": false,
          "type": "string"
        },
        {
          "name": "deal_name",
          "required": false,
          "type": "string"
        },
        {
          "name": "target_entity_id",
          "required": false,
          "type": "string"
        },
        {
          "name": "strategy",
          "required": false,
          "type": "string"
        },
        {
          "name": "originating_team",
          "required": false,
          "type": "string"
        },
        {
          "name": "source_channel",
          "required": false,
          "type": "string"
        },
        {
          "name": "sourced_date",
          "required": false,
          "type": "string"
        },
        {
          "name": "structure",
          "required": false,
          "type": "string"
        },
        {
          "name": "converted_record_type",
          "required": false,
          "type": "string"
        },
        {
          "name": "converted_record_id",
          "required": false,
          "type": "string"
        }
      ],
      "name": "investment.origo_deal_extract"
    }
  ],
  "schema": "ergasterion.product-contract/v1",
  "support": "platform-support",
  "team": "data-product-factory",
  "versioningPolicy": "additive nullable fields are minor and non-breaking; removals, renames, type changes and new required fields are major and breaking"
}
