{
  "access": {
    "classification": "confidential"
  },
  "description": "The storefront's customer extract as it was delivered: one row per delivered customer record, no column changed.",
  "freshness": "daily by 05:00 UTC",
  "identity": {
    "domain": "ecommerce",
    "major": 1,
    "name": "cartivo_customer_extract",
    "namespace": "io.antikas.ergasterion"
  },
  "lineage": [
    "ecommerce.cartivo_customer_extract_delivery@1"
  ],
  "quality": [
    {
      "description": "cartivo_record_id must not be null",
      "dimension": "completeness"
    },
    {
      "description": "cartivo_record_id must be unique",
      "dimension": "uniqueness"
    }
  ],
  "relations": [
    {
      "fields": [
        {
          "name": "cartivo_record_id",
          "required": false,
          "type": "string"
        },
        {
          "name": "cartivo_customer_id",
          "required": false,
          "type": "string"
        },
        {
          "name": "loyalty_id",
          "required": false,
          "type": "string"
        },
        {
          "name": "email",
          "required": false,
          "type": "string"
        },
        {
          "name": "full_name",
          "required": false,
          "type": "string"
        },
        {
          "name": "phone",
          "required": false,
          "type": "string"
        },
        {
          "name": "address_line",
          "required": false,
          "type": "string"
        },
        {
          "name": "city",
          "required": false,
          "type": "string"
        },
        {
          "name": "postal_code",
          "required": false,
          "type": "string"
        },
        {
          "name": "country",
          "required": false,
          "type": "string"
        },
        {
          "name": "marketing_consent",
          "required": false,
          "type": "string"
        },
        {
          "name": "preferred_channel",
          "required": false,
          "type": "string"
        },
        {
          "name": "customer_status",
          "required": false,
          "type": "string"
        },
        {
          "name": "as_of_date",
          "required": false,
          "type": "string"
        }
      ],
      "name": "ecommerce.cartivo_customer_extract"
    }
  ],
  "schema": "ergasterion.product-contract/v1",
  "support": "platform-support",
  "team": "data-product-factory",
  "versioningPolicy": "additive nullable fields are minor and non-breaking; removals, renames, type changes and new required fields are major and breaking"
}
