{
  "access": {
    "classification": "confidential"
  },
  "description": "The marketplace's order header extract as it was delivered, no column changed.",
  "freshness": "daily by 05:00 UTC",
  "identity": {
    "domain": "ecommerce",
    "major": 1,
    "name": "mercaro_order_extract",
    "namespace": "io.antikas.ergasterion"
  },
  "lineage": [
    "ecommerce.mercaro_order_extract_delivery@1"
  ],
  "quality": [
    {
      "description": "mercaro_record_id must not be null",
      "dimension": "completeness"
    },
    {
      "description": "mercaro_record_id must be unique",
      "dimension": "uniqueness"
    }
  ],
  "relations": [
    {
      "fields": [
        {
          "name": "mercaro_record_id",
          "required": false,
          "type": "string"
        },
        {
          "name": "mercaro_order_id",
          "required": false,
          "type": "string"
        },
        {
          "name": "mercaro_customer_id",
          "required": false,
          "type": "string"
        },
        {
          "name": "order_date",
          "required": false,
          "type": "string"
        },
        {
          "name": "order_status",
          "required": false,
          "type": "string"
        },
        {
          "name": "currency",
          "required": false,
          "type": "string"
        },
        {
          "name": "order_total",
          "required": false,
          "type": "string"
        },
        {
          "name": "channel",
          "required": false,
          "type": "string"
        }
      ],
      "name": "ecommerce.mercaro_order_extract"
    }
  ],
  "schema": "ergasterion.product-contract/v1",
  "support": "platform-support",
  "team": "data-product-factory",
  "versioningPolicy": "additive nullable fields are minor and non-breaking; removals, renames, type changes and new required fields are major and breaking"
}
