{
  "access": {
    "classification": "confidential"
  },
  "description": "Customers as the contact system states them, on the schema the three feeds share.",
  "freshness": "daily by 06:00 UTC",
  "identity": {
    "domain": "ecommerce",
    "major": 1,
    "name": "relatio_customer",
    "namespace": "io.antikas.ergasterion"
  },
  "lineage": [
    "ecommerce.relatio_customer_extract@1"
  ],
  "quality": [
    {
      "description": "relatio_record_id must not be null",
      "dimension": "completeness"
    },
    {
      "description": "email must not be null",
      "dimension": "completeness"
    }
  ],
  "relations": [
    {
      "fields": [
        {
          "name": "loyalty_id",
          "required": false,
          "type": "string"
        },
        {
          "name": "email",
          "required": true,
          "type": "string"
        },
        {
          "name": "full_name",
          "required": false,
          "type": "string"
        },
        {
          "name": "phone",
          "required": false,
          "type": "string"
        },
        {
          "name": "address_line",
          "required": false,
          "type": "string"
        },
        {
          "name": "city",
          "required": false,
          "type": "string"
        },
        {
          "name": "postal_code",
          "required": false,
          "type": "string"
        },
        {
          "name": "country",
          "required": false,
          "type": "string"
        },
        {
          "name": "customer_status",
          "required": false,
          "type": "string"
        },
        {
          "name": "source_record_id",
          "required": false,
          "type": "string"
        },
        {
          "name": "source_customer_id",
          "required": false,
          "type": "string"
        },
        {
          "name": "as_of_date",
          "required": false,
          "type": "date"
        },
        {
          "name": "source_system",
          "required": false,
          "type": "string"
        },
        {
          "name": "normalised_email",
          "required": false,
          "type": "string"
        },
        {
          "name": "customer_business_key",
          "required": false,
          "type": "string"
        },
        {
          "name": "customer_email_domain",
          "required": false,
          "type": "string"
        },
        {
          "name": "marketing_consent",
          "required": false,
          "type": "string"
        },
        {
          "name": "preferred_channel",
          "required": false,
          "type": "string"
        },
        {
          "name": "buyer_segment",
          "required": false,
          "type": "string"
        }
      ],
      "name": "ecommerce.relatio_customer"
    }
  ],
  "schema": "ergasterion.product-contract/v1",
  "support": "platform-support",
  "team": "data-product-factory",
  "versioningPolicy": "additive nullable fields are minor and non-breaking; removals, renames, type changes and new required fields are major and breaking"
}
