{
  "access": {
    "classification": "confidential"
  },
  "description": "Each delivered fund valuation date, against the fund the estate resolved and the basis and hurdle it declares.",
  "freshness": "daily by 08:00 UTC",
  "identity": {
    "domain": "investment",
    "major": 1,
    "name": "fund_nav_resolved",
    "namespace": "io.antikas.ergasterion"
  },
  "lineage": [
    "investment.meridex_fund_nav@1"
  ],
  "quality": [
    {
      "description": "source_record_id must not be null",
      "dimension": "completeness"
    },
    {
      "description": "source_valued_on must not be null",
      "dimension": "completeness"
    }
  ],
  "relations": [
    {
      "fields": [
        {
          "name": "source_record_id",
          "required": true,
          "type": "string"
        },
        {
          "name": "source_fund_id",
          "required": false,
          "type": "string"
        },
        {
          "name": "source_valued_on",
          "required": true,
          "type": "date"
        },
        {
          "name": "source_nav_usd",
          "required": false,
          "type": {
            "name": "decimal",
            "precision": 18,
            "scale": 2
          }
        },
        {
          "name": "source_called_capital_usd",
          "required": false,
          "type": {
            "name": "decimal",
            "precision": 18,
            "scale": 2
          }
        },
        {
          "name": "source_distributed_capital_usd",
          "required": false,
          "type": {
            "name": "decimal",
            "precision": 18,
            "scale": 2
          }
        },
        {
          "name": "nav_source_system",
          "required": false,
          "type": "string"
        },
        {
          "name": "fund_nav_source_key",
          "required": false,
          "type": "string"
        },
        {
          "name": "fund_business_key",
          "required": false,
          "type": "string"
        },
        {
          "name": "fund_external_id",
          "required": false,
          "type": "string"
        },
        {
          "name": "source_name",
          "required": false,
          "type": "string"
        },
        {
          "name": "source_strategy",
          "required": false,
          "type": "string"
        },
        {
          "name": "source_currency",
          "required": false,
          "type": "string"
        },
        {
          "name": "fund_recallable_distributions_usd",
          "required": false,
          "type": {
            "name": "decimal",
            "precision": 18,
            "scale": 2
          }
        },
        {
          "name": "fund_fee_offset_usd",
          "required": false,
          "type": {
            "name": "decimal",
            "precision": 18,
            "scale": 2
          }
        },
        {
          "name": "fund_hurdle_rate",
          "required": false,
          "type": {
            "name": "decimal",
            "precision": 6,
            "scale": 4
          }
        },
        {
          "name": "fund_hurdle_basis",
          "required": false,
          "type": "string"
        }
      ],
      "name": "investment.fund_nav_resolved"
    }
  ],
  "schema": "ergasterion.product-contract/v1",
  "support": "platform-support",
  "team": "data-product-factory",
  "versioningPolicy": "additive nullable fields are minor and non-breaking; removals, renames, type changes and new required fields are major and breaking"
}
