{
  "access": {
    "classification": "confidential"
  },
  "description": "The PORTIQ portfolio system fund feed as it was delivered, one row per delivered fund record.",
  "freshness": "daily by 05:00 UTC",
  "identity": {
    "domain": "investment",
    "major": 1,
    "name": "portiq_fund_extract",
    "namespace": "io.antikas.ergasterion"
  },
  "lineage": [
    "investment.portiq_fund_extract_delivery@1"
  ],
  "quality": [
    {
      "description": "portiq_fund_id must not be null",
      "dimension": "completeness"
    },
    {
      "description": "portiq_fund_id must be unique",
      "dimension": "uniqueness"
    },
    {
      "description": "fund_name must not be null",
      "dimension": "completeness"
    }
  ],
  "relations": [
    {
      "fields": [
        {
          "name": "portiq_fund_id",
          "required": false,
          "type": "string"
        },
        {
          "name": "fund_name",
          "required": false,
          "type": "string"
        },
        {
          "name": "gp_name",
          "required": false,
          "type": "string"
        },
        {
          "name": "gp_lei",
          "required": false,
          "type": "string"
        },
        {
          "name": "fund_lei",
          "required": false,
          "type": "string"
        },
        {
          "name": "shared_external_id",
          "required": false,
          "type": "string"
        },
        {
          "name": "asset_class",
          "required": false,
          "type": "string"
        },
        {
          "name": "strategy",
          "required": false,
          "type": "string"
        },
        {
          "name": "vintage_year",
          "required": false,
          "type": "string"
        },
        {
          "name": "currency",
          "required": false,
          "type": "string"
        }
      ],
      "name": "investment.portiq_fund_extract"
    }
  ],
  "schema": "ergasterion.product-contract/v1",
  "support": "platform-support",
  "team": "data-product-factory",
  "versioningPolicy": "additive nullable fields are minor and non-breaking; removals, renames, type changes and new required fields are major and breaking"
}
