{
  "access": {
    "classification": "confidential"
  },
  "description": "The VANTORA book-of-record portfolio company feed as it was delivered, one row per delivered company record.",
  "freshness": "daily by 05:00 UTC",
  "identity": {
    "domain": "investment",
    "major": 1,
    "name": "vantora_portfolio_company_extract",
    "namespace": "io.antikas.ergasterion"
  },
  "lineage": [
    "investment.vantora_portfolio_company_extract_delivery@1"
  ],
  "quality": [
    {
      "description": "vantora_company_id must not be null",
      "dimension": "completeness"
    },
    {
      "description": "vantora_company_id must be unique",
      "dimension": "uniqueness"
    },
    {
      "description": "company_name must not be null",
      "dimension": "completeness"
    }
  ],
  "relations": [
    {
      "fields": [
        {
          "name": "vantora_company_id",
          "required": false,
          "type": "string"
        },
        {
          "name": "vantora_fund_id",
          "required": false,
          "type": "string"
        },
        {
          "name": "company_name",
          "required": false,
          "type": "string"
        },
        {
          "name": "company_lei",
          "required": false,
          "type": "string"
        },
        {
          "name": "shared_external_id",
          "required": false,
          "type": "string"
        },
        {
          "name": "sector",
          "required": false,
          "type": "string"
        },
        {
          "name": "sub_sector",
          "required": false,
          "type": "string"
        },
        {
          "name": "country",
          "required": false,
          "type": "string"
        },
        {
          "name": "status",
          "required": false,
          "type": "string"
        },
        {
          "name": "first_seen_at",
          "required": false,
          "type": "string"
        }
      ],
      "name": "investment.vantora_portfolio_company_extract"
    }
  ],
  "schema": "ergasterion.product-contract/v1",
  "support": "platform-support",
  "team": "data-product-factory",
  "versioningPolicy": "additive nullable fields are minor and non-breaking; removals, renames, type changes and new required fields are major and breaking"
}
