{
  "access": {
    "classification": "confidential"
  },
  "description": "Funds as PORTIQ states them, on the schema the four fund feeds share.",
  "freshness": "daily by 06:00 UTC",
  "identity": {
    "domain": "investment",
    "major": 1,
    "name": "portiq_fund",
    "namespace": "io.antikas.ergasterion"
  },
  "lineage": [
    "investment.portiq_fund_extract@1"
  ],
  "quality": [
    {
      "description": "portiq_fund_id must not be null",
      "dimension": "completeness"
    },
    {
      "description": "fund_name must not be null",
      "dimension": "completeness"
    }
  ],
  "relations": [
    {
      "fields": [
        {
          "name": "source_fund_id",
          "required": false,
          "type": "string"
        },
        {
          "name": "source_name",
          "required": false,
          "type": "string"
        },
        {
          "name": "source_gp_name",
          "required": false,
          "type": "string"
        },
        {
          "name": "source_gp_lei",
          "required": false,
          "type": "string"
        },
        {
          "name": "source_lei",
          "required": false,
          "type": "string"
        },
        {
          "name": "source_external_id",
          "required": false,
          "type": "string"
        },
        {
          "name": "source_asset_class",
          "required": false,
          "type": "string"
        },
        {
          "name": "source_strategy",
          "required": false,
          "type": "string"
        },
        {
          "name": "source_vintage_year",
          "required": false,
          "type": "integer"
        },
        {
          "name": "source_currency",
          "required": false,
          "type": "string"
        },
        {
          "name": "source_record_id",
          "required": false,
          "type": "string"
        },
        {
          "name": "source_family_name",
          "required": false,
          "type": "string"
        },
        {
          "name": "source_vehicle_type",
          "required": false,
          "type": "string"
        },
        {
          "name": "source_gp_id",
          "required": false,
          "type": "string"
        },
        {
          "name": "source_committed_capital_usd",
          "required": false,
          "type": {
            "name": "decimal",
            "precision": 18,
            "scale": 2
          }
        },
        {
          "name": "source_domicile",
          "required": false,
          "type": "string"
        },
        {
          "name": "source_status",
          "required": false,
          "type": "string"
        },
        {
          "name": "source_reported_on",
          "required": false,
          "type": "date"
        },
        {
          "name": "fund_source_system",
          "required": false,
          "type": "string"
        },
        {
          "name": "fund_identity_key",
          "required": false,
          "type": "string"
        },
        {
          "name": "fund_normalised_name",
          "required": false,
          "type": "string"
        },
        {
          "name": "fund_normalised_gp_name",
          "required": false,
          "type": "string"
        },
        {
          "name": "fund_lei",
          "required": false,
          "type": "string"
        },
        {
          "name": "fund_external_id",
          "required": false,
          "type": "string"
        },
        {
          "name": "fund_gp_lei",
          "required": false,
          "type": "string"
        }
      ],
      "name": "investment.portiq_fund"
    }
  ],
  "schema": "ergasterion.product-contract/v1",
  "support": "platform-support",
  "team": "data-product-factory",
  "versioningPolicy": "additive nullable fields are minor and non-breaking; removals, renames, type changes and new required fields are major and breaking"
}
