{
  "access": {
    "classification": "confidential"
  },
  "description": "The deal vault: identity, payload versions, the surviving record and the point-in-time relation over them.",
  "freshness": "daily by 08:00 UTC",
  "identity": {
    "domain": "investment",
    "major": 1,
    "name": "deal_vault",
    "namespace": "io.antikas.ergasterion"
  },
  "lineage": [
    "investment.deal_conformed@1"
  ],
  "quality": [
    {
      "description": "source_record_id must not be null",
      "dimension": "completeness"
    },
    {
      "description": "source_name must not be null",
      "dimension": "completeness"
    },
    {
      "description": "deal_business_key must not be null",
      "dimension": "completeness"
    },
    {
      "description": "deal_business_key must be unique",
      "dimension": "uniqueness"
    }
  ],
  "relations": [
    {
      "fields": [
        {
          "name": "deal_hk",
          "required": true,
          "type": "string"
        },
        {
          "name": "deal_business_key",
          "required": true,
          "type": "string"
        },
        {
          "name": "load_datetime",
          "required": true,
          "type": "timestamp"
        },
        {
          "name": "record_source",
          "required": true,
          "type": "string"
        }
      ],
      "name": "investment.deal_vault__hub_deal"
    },
    {
      "fields": [
        {
          "name": "portfolio_company_hk",
          "required": true,
          "type": "string"
        },
        {
          "name": "deal_company_business_key",
          "required": true,
          "type": "string"
        },
        {
          "name": "load_datetime",
          "required": true,
          "type": "timestamp"
        },
        {
          "name": "record_source",
          "required": true,
          "type": "string"
        }
      ],
      "name": "investment.deal_vault__hub_portfolio_company"
    },
    {
      "fields": [
        {
          "name": "fund_hk",
          "required": true,
          "type": "string"
        },
        {
          "name": "deal_fund_business_key",
          "required": true,
          "type": "string"
        },
        {
          "name": "load_datetime",
          "required": true,
          "type": "timestamp"
        },
        {
          "name": "record_source",
          "required": true,
          "type": "string"
        }
      ],
      "name": "investment.deal_vault__hub_fund"
    },
    {
      "fields": [
        {
          "name": "deal_portfolio_company_lhk",
          "required": true,
          "type": "string"
        },
        {
          "name": "deal_hk",
          "required": true,
          "type": "string"
        },
        {
          "name": "portfolio_company_hk",
          "required": true,
          "type": "string"
        },
        {
          "name": "load_datetime",
          "required": true,
          "type": "timestamp"
        },
        {
          "name": "record_source",
          "required": true,
          "type": "string"
        }
      ],
      "name": "investment.deal_vault__link_deal_portfolio_company"
    },
    {
      "fields": [
        {
          "name": "deal_fund_lhk",
          "required": true,
          "type": "string"
        },
        {
          "name": "deal_hk",
          "required": true,
          "type": "string"
        },
        {
          "name": "fund_hk",
          "required": true,
          "type": "string"
        },
        {
          "name": "load_datetime",
          "required": true,
          "type": "timestamp"
        },
        {
          "name": "record_source",
          "required": true,
          "type": "string"
        }
      ],
      "name": "investment.deal_vault__link_deal_fund"
    },
    {
      "fields": [
        {
          "name": "deal_hk",
          "required": true,
          "type": "string"
        },
        {
          "name": "hashdiff",
          "required": true,
          "type": "string"
        },
        {
          "name": "hashdiff_basis_version",
          "required": true,
          "type": "integer"
        },
        {
          "name": "deal_name",
          "required": false,
          "type": "string"
        },
        {
          "name": "deal_strategy",
          "required": false,
          "type": "string"
        },
        {
          "name": "deal_structure",
          "required": false,
          "type": "string"
        },
        {
          "name": "deal_channel",
          "required": false,
          "type": "string"
        },
        {
          "name": "deal_target_company_external_id",
          "required": false,
          "type": "string"
        },
        {
          "name": "effective_from",
          "required": true,
          "type": "date"
        },
        {
          "name": "load_datetime",
          "required": true,
          "type": "timestamp"
        },
        {
          "name": "record_source",
          "required": true,
          "type": "string"
        }
      ],
      "name": "investment.deal_vault__sat_deal_detail"
    },
    {
      "fields": [
        {
          "name": "deal_hk",
          "required": true,
          "type": "string"
        },
        {
          "name": "hashdiff",
          "required": true,
          "type": "string"
        },
        {
          "name": "hashdiff_basis_version",
          "required": true,
          "type": "integer"
        },
        {
          "name": "deal_originating_team",
          "required": false,
          "type": "string"
        },
        {
          "name": "deal_converted_record_type",
          "required": false,
          "type": "string"
        },
        {
          "name": "deal_converted_fund_external_id",
          "required": false,
          "type": "string"
        },
        {
          "name": "deal_external_identity",
          "required": false,
          "type": "string"
        },
        {
          "name": "effective_from",
          "required": true,
          "type": "date"
        },
        {
          "name": "load_datetime",
          "required": true,
          "type": "timestamp"
        },
        {
          "name": "record_source",
          "required": true,
          "type": "string"
        }
      ],
      "name": "investment.deal_vault__sat_deal_pipeline"
    },
    {
      "fields": [
        {
          "name": "deal_hk",
          "required": true,
          "type": "string"
        },
        {
          "name": "deal_business_key",
          "required": true,
          "type": "string"
        },
        {
          "name": "deal_name",
          "required": false,
          "type": "string"
        },
        {
          "name": "deal_strategy",
          "required": false,
          "type": "string"
        },
        {
          "name": "deal_structure",
          "required": false,
          "type": "string"
        },
        {
          "name": "deal_channel",
          "required": false,
          "type": "string"
        },
        {
          "name": "deal_originating_team",
          "required": false,
          "type": "string"
        },
        {
          "name": "deal_target_company_external_id",
          "required": false,
          "type": "string"
        },
        {
          "name": "deal_converted_record_type",
          "required": false,
          "type": "string"
        },
        {
          "name": "deal_converted_fund_external_id",
          "required": false,
          "type": "string"
        },
        {
          "name": "deal_external_identity",
          "required": false,
          "type": "string"
        },
        {
          "name": "load_datetime",
          "required": true,
          "type": "timestamp"
        },
        {
          "name": "record_source",
          "required": true,
          "type": "string"
        }
      ],
      "name": "investment.deal_vault__golden_deal"
    },
    {
      "fields": [
        {
          "name": "deal_hk",
          "required": true,
          "type": "string"
        },
        {
          "name": "as_of",
          "required": true,
          "type": "date"
        },
        {
          "name": "deal_detail_effective_from",
          "required": false,
          "type": "date"
        },
        {
          "name": "deal_pipeline_effective_from",
          "required": false,
          "type": "date"
        }
      ],
      "name": "investment.deal_vault__pit_deal"
    }
  ],
  "schema": "ergasterion.product-contract/v1",
  "support": "platform-support",
  "team": "data-product-factory",
  "versioningPolicy": "additive nullable fields are minor and non-breaking; removals, renames, type changes and new required fields are major and breaking"
}
